{
  "$schema": "https://json-schema.org/draft/2020-12/schema",
  "$id": "shieldkit-labs/p2/gate-b/gate-b1-additive-language-authority/v1/crossmap-snapshot-root/v1",
  "type": "object",
  "additionalProperties": false,
  "required": [
    "schema",
    "artifactId",
    "status",
    "sealed",
    "packageLifecycle",
    "sourceClosure",
    "laneCredit",
    "gateEffect",
    "snapshotProjection",
    "snapshotDigest",
    "legacyRaw",
    "sourceCollision",
    "nonClaims"
  ],
  "properties": {
    "schema": {
      "const": "shieldkit-labs/p2/gate-b/gate-b1-additive-language-authority/v1/crossmap-snapshot-root/v1"
    },
    "artifactId": {
      "const": "artifact:gate-b:gate-b1-additive-language-authority-v1:crossmap-snapshot-root-v1"
    },
    "status": {
      "const": "STATIC_DETACHED_UNSEALED_CROSSMAP_SNAPSHOT_NO_SOURCE_CLOSURE_NO_CREDIT"
    },
    "sealed": {
      "const": false
    },
    "packageLifecycle": {
      "const": "INTENTIONALLY_UNSEALED_DETACHED_NO_MANIFEST_NO_CHECKSUM_LIST"
    },
    "sourceClosure": {
      "const": false
    },
    "laneCredit": {
      "const": "NONE"
    },
    "gateEffect": {
      "const": "NONE"
    },
    "snapshotProjection": {
      "const": {
        "packagePath": "research-lanes/bch-shielded-pool-design/p2/gate-b/gate-b1-typed-protocol-descriptor-schema-v1-additive-crossmap-v1",
        "packageLifecycle": "INTENTIONALLY_UNSEALED_DETACHED",
        "files": [
          {
            "ordinal": 0,
            "locator": "README.md",
            "bytes": 964,
            "rawSha256": "f80c1cc18849eb2b8bb04ee33d53a2649bf0cdef0331cdcc079a969e7b96ab2d"
          },
          {
            "ordinal": 1,
            "locator": "static-crossmap-v1.schema.json",
            "bytes": 5271,
            "rawSha256": "85422163b6e0c53b2459d317e48d94d3bdfd6f9fd24736b65adb667e34523b35"
          },
          {
            "ordinal": 2,
            "locator": "static-crossmap-v1.json",
            "bytes": 20756,
            "rawSha256": "60bbbc717693f8e41b7d3c7cf1a2ed83045fe91f7707cbd33ce881a2c83cbfd0"
          }
        ],
        "laneContext": {
          "laneId": "research-lane:bch-shielded-pool-design",
          "relationship": "CURRENT_CONTEXT_ONLY_NOT_CROSSMAP_DEPENDENCY_REWRITE",
          "projectionSchema": "shieldkit-labs/p2/gate-b/gate-b0-evidence-plan/v1/lane-authority-projection/v1",
          "projectionDigest": {
            "algorithm": "sha256",
            "canonicalization": "recursive-lexicographic-object-key-sort-arrays-preserve-order-json-utf8-lf-v1",
            "domain": "shieldkit-labs/p2/gate-b/gate-b0-evidence-plan/v1/lane-authority-projection",
            "frame": "utf8(domain)||0x00||canonical-json-utf8||0x0a",
            "value": "7ab73381ae474648873d94f99d7227b9558f5fbb49eff8066132f0b2520ba138"
          }
        }
      }
    },
    "snapshotDigest": {
      "const": {
        "algorithm": "sha256",
        "canonicalization": "recursive-lexicographic-object-key-sort-arrays-preserve-order-json-utf8-lf-v1",
        "domain": "shieldkit-labs/p2/gate-b/gate-b1-additive-language-authority/v1/crossmap-snapshot",
        "frame": "utf8(domain)||0x00||canonical-json-utf8||0x0a",
        "preimageKind": "EXACT_JSON_POINTER_VALUE",
        "jsonPointer": "/snapshotProjection",
        "excludedTopLevelKeys": [
          "schema",
          "artifactId",
          "status",
          "sealed",
          "packageLifecycle",
          "sourceClosure",
          "laneCredit",
          "gateEffect",
          "snapshotDigest",
          "legacyRaw",
          "sourceCollision",
          "nonClaims"
        ],
        "value": "4fab4fd9def866220d1f99b3339b9ca0567d5ac68e79bf80260a9ebb7202096f"
      }
    },
    "legacyRaw": {
      "const": {
        "present": false,
        "sourceClosure": false
      }
    },
    "sourceCollision": {
      "const": {
        "collisionId": "UOPC_EAC_FUTURE_PROVIDER_DAG_DIVERGENCE",
        "status": "UNRESOLVED_EXTERNAL_PRECEDENCE",
        "selectedDag": null,
        "selectedAPath": null,
        "packageMayInfer": false,
        "packageMaySelectSource": false,
        "admissionAllowed": false,
        "resolvedByThisDecision": false
      }
    },
    "nonClaims": {
      "const": [
        "NOT_LEGACY_SOURCE_CLOSURE",
        "NOT_RETROACTIVE_AUTHORITY",
        "NOT_A_ROOT_SOL_DECISION_RECORD",
        "NOT_ACTIVE_LANGUAGE_RATIFICATION",
        "NOT_A_PROTOCOL_DESCRIPTOR",
        "NOT_TYPED_DESCRIPTOR_V2",
        "NOT_PENDING_MARKER_RESOLUTION",
        "NOT_ROLE_ASSIGNMENT",
        "NOT_PARAMETER_ASSIGNMENT",
        "NOT_CANDIDATE_OR_TUPLE_CREATION",
        "NOT_GATE_REOPEN",
        "NOT_LANE_INTEGRATION",
        "NOT_REFREEZE_AUTHORITY",
        "NOT_SELECTION_AUTHORITY",
        "NOT_ADMISSION_AUTHORITY",
        "NOT_EXECUTION_AUTHORITY",
        "NOT_PRECEDENCE_COLLISION_RESOLUTION"
      ]
    }
  }
}
